{
  "claim": "local-file-two-agent-v0",
  "ir_sha256": "b4b5a3061103ec3e3f8a386409b78c44a7fe72d5c523f9e1d5102beebc965528",
  "kernel_checked_obligations": [
    "direct protected-resource authority",
    "nonzero UIDs",
    "all agent/trusted UID separation",
    "exact role counts",
    "runtime match",
    "exact sink/database writer sets",
    "transitive bypass reachability and closure",
    "no unknown/privileged/host-network authority",
    "reused gate/one-use/budget contracts"
  ],
  "lean": {
    "accepted": true,
    "axioms": "'SliceInstance.facts_checked' depends on axioms: [propext, Quot.sound]\n'ControlStack.Deployment.protocol_safe' depends on axioms: [propext, Quot.sound]\n'ControlStack.Deployment.one_use' depends on axioms: [propext, Quot.sound]\n'ControlStack.Deployment.gate_contract' depends on axioms: [propext, Quot.sound]\n'ControlStack.Deployment.broker_contract' depends on axioms: [propext, Quot.sound]\n'ControlStack.Deployment.runtime_exclusive' depends on axioms: [propext, Quot.sound]\n'ControlStack.Deployment.deployment_safe' depends on axioms: [propext, Quot.sound]\n'SliceInstance.contract_checked' depends on axioms: [propext, Quot.sound]\n'SliceInstance.one_use_checked' depends on axioms: [propext, Quot.sound]\n",
    "source": "import ControlStack.Deployment.Contracts\nopen ControlStack.Deployment\nnamespace SliceInstance\ndef deployment : IR := \u27e8[\u27e83,23701,true,false,false,0,true\u27e9,\u27e84,23702,true,false,false,0,true\u27e9,\u27e85,23704,false,false,false,4,true\u27e9,\u27e86,23700,false,false,false,1,true\u27e9,\u27e87,23700,false,false,false,2,true\u27e9,\u27e88,23703,false,false,false,3,true\u27e9],[\u27e83,6,false,false,false\u27e9,\u27e84,6,false,false,false\u27e9,\u27e85,6,false,false,false\u27e9,\u27e86,1,true,false,true\u27e9,\u27e87,1,true,false,true\u27e9,\u27e87,0,true,false,true\u27e9,\u27e88,6,false,false,false\u27e9],7,6,0,1\u27e9\ntheorem facts_checked : Accepted deployment := by decide\n#print axioms SliceInstance.facts_checked\n#print axioms ControlStack.Deployment.protocol_safe\n#print axioms ControlStack.Deployment.one_use\n#print axioms ControlStack.Deployment.gate_contract\n#print axioms ControlStack.Deployment.broker_contract\n#print axioms ControlStack.Deployment.runtime_exclusive\n#print axioms ControlStack.Deployment.deployment_safe\nend SliceInstance\n\nnamespace SliceInstance\ndef principals : ControlStack.SC26.Roles := roles deployment 23700 [23704] [23700]\ntheorem contract_checked (ops : List ControlStack.SC26.Op) (hops : \u2200 o \u2208 ops, ControlStack.SC26.legal principals o) : ControlStack.SC26.Good principals 1 (ControlStack.SC26.run principals 1 ControlStack.SC26.full ControlStack.SC26.init ops) := protocol_safe principals 1 ops hops\ntheorem one_use_checked (ops : List ControlStack.SC26.Op) : (ControlStack.SC26.run principals 1 ControlStack.SC26.full ControlStack.SC26.init ops).reserved.Nodup := one_use principals 1 ops\nend SliceInstance\n#print axioms SliceInstance.contract_checked\n#print axioms SliceInstance.one_use_checked\n"
  },
  "obligations": [
    {
      "detail": "two agents, one named broker and one named receiver required",
      "premise": "supported-roles",
      "status": "CONDITIONAL"
    },
    {
      "detail": "distinct agent/trusted UIDs; only broker/receiver share trusted owner; trusted-role-uid-collision on failure",
      "premise": "identity-separation",
      "status": "CONDITIONAL"
    },
    {
      "detail": "MATCH",
      "premise": "runtime-snapshot:agent-a",
      "status": "CONDITIONAL"
    },
    {
      "detail": "MATCH",
      "premise": "runtime-snapshot:agent-b",
      "status": "CONDITIONAL"
    },
    {
      "detail": "MATCH",
      "premise": "runtime-snapshot:approver",
      "status": "CONDITIONAL"
    },
    {
      "detail": "MATCH",
      "premise": "runtime-snapshot:broker",
      "status": "CONDITIONAL"
    },
    {
      "detail": "MATCH",
      "premise": "runtime-snapshot:receiver",
      "status": "CONDITIONAL"
    },
    {
      "detail": "MATCH",
      "premise": "runtime-snapshot:reviewer",
      "status": "CONDITIONAL"
    },
    {
      "detail": "exactly the receiver has the writable sink mount",
      "premise": "useful-sink-path",
      "status": "CONDITIONAL"
    },
    {
      "detail": "broker and receiver must use the same pinned database",
      "premise": "shared-database",
      "status": "CONDITIONAL"
    },
    {
      "detail": "snapshot exhausts actual effective authority, mounts, identities, processes and source/image correspondence; unproved",
      "premise": "faithful-extraction",
      "status": "CONDITIONAL"
    },
    {
      "detail": "ProtocolRefinement.publication : sinkEffects = model.bank assumes full model-runtime correspondence, including actual protocol transitions, exact bytes, unit costs, clock, storage and no rollback; unproved",
      "premise": "protocol-refinement",
      "status": "CONDITIONAL"
    },
    {
      "detail": "'SliceInstance.facts_checked' depends on axioms: [propext, Quot.sound]\n'ControlStack.Deployment.protocol_safe' depends on axioms: [propext, Quot.sound]\n'ControlStack.Deployment.one_use' depends on axioms: [propext, Quot.sound]\n'ControlStack.Deployment.gate_contract' depends on axioms: [propext, Quot.sound]\n'ControlStack.Deployment.broker_contract' depends on axioms: [propext, Quot.sound]\n'ControlStack.Deployment.runtime_exclusive' depends on axioms: [propext, Quot.sound]\n'ControlStack.Deployment.deployment_safe' depends on axioms: [propext, Quot.sound]\n'SliceInstance.contract_checked' depends on axioms: [propext, Quot.sound]\n'SliceInstance.one_use_checked' depends on axioms: [propext, Quot.sound]\n",
      "premise": "Lean-contract-instances",
      "status": "PROVEN_IN_MODEL"
    }
  ],
  "python_only_obligations": [],
  "scope": "configuration/model candidate; skipped kernel check means UNASSURED. Lean rechecks all finite configuration obligations; faithful extraction and protocol refinement remain unproved",
  "snapshot": {
    "broker_sha256": "fa046623384cb237eb21fefd616bde3bf4bdbbf7127a0dc449df21209f532549",
    "budget": 1,
    "compose_sha256": "f72f077768b41212f1963fcf22a091e653d7e3d6c1cac61a912ed1c272df7885",
    "database_source": "/var/tmp/sol-deployment-slice-20261010/deployment-container-state/db",
    "receiver_sha256": "319e1578169e7be617f994ea2d828019d174b6c2a915370fc9f489501de0bba1",
    "runtime_sha256": "eba45d032cd09d69f6b919ff0724b294c77ed21e20fc5bacbd7f1eed9a56d173",
    "sink_source": "/var/tmp/sol-deployment-slice-20261010/deployment-container-state/sink"
  },
  "verdict": "CONDITIONAL",
  "version": "0.1"
}
